{
  "schemaVersion": 1,
  "framework": {
    "versionLane": "current-source",
    "identity": "78127e51cd740ccdbd58d326e05426caf4e49795",
    "bundleFingerprint": "bc45e520cd3e6f92310abfd999c3da209518b467e59575a13dbfa70f2ebd08e9"
  },
  "generatedSource": {
    "packageName": "generated.viewcompose",
    "functionName": "ProfileCardView",
    "kotlinFingerprint": "15b15098e92b62bc9730ab7b3f2bde7715596f22069490a18b1e7830ff92ad35",
    "artifactIds": ["viewcompose-ui-foundation"],
    "declaredBindings": [
      { "parameter": "profileAvatar", "source": "@drawable/profile_avatar", "type": "ImageSource" },
      { "parameter": "profilePhoto", "source": "@string/profile_photo", "type": "String" },
      { "parameter": "statusLabel", "source": "@string/status_label", "type": "String" }
    ]
  },
  "bindings": [
    {
      "kind": "image-source",
      "parameter": "profileAvatar",
      "source": "@drawable/profile_avatar"
    },
    {
      "kind": "string",
      "parameter": "profilePhoto",
      "source": "@string/profile_photo",
      "value": "Profile photo"
    },
    {
      "kind": "string",
      "parameter": "statusLabel",
      "source": "@string/status_label",
      "value": "Available"
    }
  ],
  "configuration": {
    "widthDp": 411,
    "heightDp": -1,
    "density": 2.625,
    "fontScale": 1,
    "localeTag": "en-US",
    "layoutDirection": "Ltr",
    "theme": "Light",
    "apiLevel": null
  },
  "lanes": {
    "compiler": "released-maven/jdk-17-or-21/gradle-9.3.1/agp-9.1.1/kotlin-2.2.10/android-36/jvm-11",
    "render": "released-maven/preview-protocol-1/paparazzi-2.0.0-alpha02/layoutlib-15.2.3"
  }
}
